Area Name,Country,Location,GPS Coordinates,Primary Photo,Subheadline,Header,Description,Tags,Photos
Naoshima,Japan,Naoshima,"34.459917,133.995244",https://media.safariportal.app/store/asset/192846/file/11b1f318414f6b2a56da16afa8f0c874.jpg,,Why we recommend it,"Naoshima is one of Japan’s most distinctive cultural destinations. It is not simply “an art island.” It is a carefully shaped environment where architecture, landscape, and contemporary art are designed to be experienced slowly.

We include Naoshima because it offers a rare type of luxury: space, silence, and intention. The art here is world-class, but the real value is how it is placed within nature and daily life. When curated well, Naoshima becomes less about museums and more about a feeling of clarity.

Naoshima sits in the Seto Inland Sea, a region defined by soft light, calm water, and a slower rhythm of life. The island’s atmosphere is central to the experience. This is not a place to rush or “cover.” It rewards travelers who enjoy long walks, open air, and time between moments.

The island is best understood through three layers: museum spaces, architectural experiences, and outdoor installations. Benesse House and Chichu Art Museum are the anchors, but the quieter magic often comes from the in-between: the way a building meets the landscape, the transition from bright sea light to shadowed interiors, the pauses built into the experience.

Naoshima is also a study in restraint. Many works are minimal, and some are intentionally subtle. It helps to approach the island with a slower mindset, allowing time to sit, observe, and revisit. We recommend spacing major museum visits, and building the day around light, weather, and ferry timing rather than strict schedules.

Logistically, Naoshima requires thoughtful planning. Museum entry often needs advance booking, and movement around the island is limited to buses, bikes, and short taxi rides. The most seamless experience comes from choosing the right sequence and leaving time buffers, especially during peak seasons.",Naoshima_RI,https://media.safariportal.app/store/asset/192847/file/40ddccdc55f02efc9d389b7962f33cb4.jpg
Hakone,Japan,Hakone,"35.233769,139.108845",https://media.safariportal.app/store/asset/2056670/file/143029e07455db3c38b6f764bf43a7aa.jpg,,Why we recommend it,"Hakone offers one of the most important contrasts in Japan: nature, hot springs, and space, within easy reach of Tokyo. It is not only a destination, but a shift in pace.

We include Hakone because it allows travelers to experience Japan through stillness. The value here is not in doing more, but in doing less with intention: a well-chosen ryokan, time in onsen, views that change with weather, and the quiet pleasure of being cared for properly.

Hakone is a mountainous region built around hot spring culture, lakeside scenery, and forested valleys. It has long been a retreat, and the best way to experience it is to lean into that purpose. Hakone is not about covering multiple sights. It is about selecting the right setting and letting the environment do the work.

Where you stay matters more in Hakone than almost anywhere else. The region is spread out, and each area creates a different experience. Gora is known for refined ryokan stays and strong access to art and gardens. Hakone Yumoto is the main gateway and works well for convenience. The Lake Ashi area offers iconic views and a calmer atmosphere. Sengokuhara feels more open and rural, with pampas grass fields and some of the most private, spacious properties.

Hakone is also one of the best places in Japan to experience traditional hospitality at a high level. A proper ryokan stay is structured around rhythm: check-in, tea, onsen, a carefully timed kaiseki dinner, deep rest, then a slow breakfast. This choreography is part of the culture. The goal is not to “fit things in,” but to protect time.

We recommend Hakone as a one to two night reset, ideally with minimal movement. If adding activities, choose one cultural element that complements the onsen experience: a museum visit, a short scenic walk, or a lake view at the right time of day.",Hakone_RI,https://media.safariportal.app/store/asset/2056659/file/f70030db06231577ae8b5c74879aa755.jpg
Shimanami Kaido,Japan,Setoda,"34.305211,133.086247",https://media.safariportal.app/store/asset/2056545/file/b484d917e19be130f14ef9565207b0d4.jpg,,Why we recommend it,"Shimanami Kaido is one of Japan’s most rewarding ways to experience landscape. It is not about reaching a destination quickly, but moving through the Seto Inland Sea at a human pace, with sea air, small ports, and changing light.

We include it because it offers a rare balance of simplicity and quality. The route feels active without being intense, scenic without being staged, and local without feeling inaccessible. When curated well, it becomes one of the most memorable experiences in Japan, especially for travelers who value nature, design, and a quieter coastal rhythm.

The Shimanami Kaido is a series of bridges connecting islands between Onomichi (Hiroshima) and Imabari (Ehime). While it is known as a cycling route, the experience is broader than cycling itself. It is a way of seeing Japan’s inland sea culture: fishing villages, citrus groves, salt air, small shrines, and understated island hospitality.

The route is flexible. Some travelers do the full crossing in one day, but the most refined experience is slower and more intentional. One or two islands, chosen well, can be more satisfying than trying to cover everything. The most memorable moments tend to be quiet: a view from a bridge, a simple lunch, a short detour to a coastal path, the feeling of arriving somewhere small and calm.

Logistics matter here. Wind, ferry timing, and daylight shape the day more than strict schedules. We recommend starting early, keeping the day lightly structured, and leaving buffer time for pauses. A well-planned Shimanami experience also includes the right equipment and support, so the day feels effortless rather than physically demanding.

This region is also one of Japan’s best examples of contemporary design integrated into rural life. Architecture, small museums, and beautifully minimal accommodations appear in unexpected places. That blend of landscape and quiet design is part of what makes the route feel distinctly Japanese.",ShimanamiKaido_RI,https://media.safariportal.app/store/asset/2056543/file/f6bb385754bec086f78467691bf7dbb8.jpg
Kumano Kodo,Japan,Kumano Kodo,"33.88852,136.100227",https://media.safariportal.app/store/asset/2065022/file/35a8d5c540b74b14542b0dd65f51118d.jpg,,Why we recommend it,"Kumano Kodo is one of Japan’s most meaningful experiences. It is not simply a hike, but a pilgrimage route shaped by nature, ritual, and time. The journey is physical, but its value is emotional: quiet effort, reflection, and a sense of place that feels unchanged.

We include Kumano Kodo because it offers a deeper layer of Japan beyond cities and iconic sights. It is ideal for travelers who want authenticity without performance, and who appreciate tradition in its original setting. When curated well, it becomes a rare experience of Japan that feels personal and lasting.

The Kumano Kodo is a network of ancient pilgrimage trails across the Kii Peninsula, historically walked by emperors, aristocrats, and common people alike. It connects the sacred Kumano Sanzan shrines: Kumano Hongu Taisha, Kumano Nachi Taisha, and Kumano Hayatama Taisha. The routes pass through cedar forests, mountain ridges, small villages, and hot spring valleys.

The experience is defined by pacing. The goal is not speed, but rhythm: steady walking, quiet stops, and long stretches without distraction. This is where the region becomes powerful. Even short sections can feel immersive, especially when paired with a traditional stay and onsen.

Planning matters because the area is remote and the trail network is varied. We curate the route based on your fitness, preferred atmosphere, and time available. The most balanced option for many travelers is a day walk on the Nakahechi route, with a stay near Yunomine or Kawayu Onsen. This allows a strong trail experience without logistical stress, while still keeping the journey authentic.

Kumano Kodo is also a place where hospitality feels rooted rather than polished. Meals are seasonal and simple, and the best accommodations focus on comfort, calm, and recovery. The contrast between exertion and restoration is part of the design of the journey.",KumanoKodo_RI,https://media.safariportal.app/store/asset/2065021/file/36477248984d07c74d1712cb3cbe1f88.jpg
Kamikochi,Japan,Kamikochi,"36.248754,137.638065",https://media.safariportal.app/store/asset/2053398/file/25d96811bee72e011e34335659297ce1.png,,Why we recommend it,"Kamikochi is one of Japan’s most pristine alpine landscapes. It offers a version of Japan that feels expansive and elemental: clear rivers, mountain air, and a quiet scale that contrasts completely with the cities.

We include Kamikochi because it delivers nature at a very high level without requiring technical hiking. It is ideal for travelers who value beauty, calm, and clean design in the natural world. When curated well, Kamikochi becomes less about “activities” and more about presence.

Kamikochi sits in the Northern Japan Alps within Chubu Sangaku National Park. The valley is protected, and access is controlled, which preserves its atmosphere. This is part of why it feels so different from other scenic areas in Japan. The environment is carefully maintained, and the experience is intentionally low impact.

The landscape is defined by water and light. The Azusa River runs through the valley, creating a clear, open corridor framed by peaks. Walks here are not difficult, but they are deeply rewarding. The paths are well-kept, the scenery changes subtly with each turn, and there are natural pauses built into the route: bridges, marshlands, and open viewpoints.

Kamikochi is best enjoyed early. Morning light is softer, the air is crisp, and the valley feels quiet before day visitors arrive. We recommend starting the day with a slow walk, allowing time to sit, observe, and return without rushing. For travelers staying overnight, the experience becomes even more special. After the buses leave, Kamikochi becomes calm and intimate, and the valley feels almost private.

This is also a destination where lodging matters. Staying inside Kamikochi allows a very different rhythm, with early access to the trails and a deeper sense of immersion. The goal is not to do more, but to choose the right walk and experience it fully.",Kamikochi_RI,https://media.safariportal.app/store/asset/2056591/file/a044f7ba42873e675534ea3a2f05c140.jpg
Okinawa,Japan,Okinawa,"26.120191,127.702501",https://media.safariportal.app/store/asset/2140241/file/52fad714adb9fdfcc593793771c039dd.jpg,,Why we recommend it,"Okinawa offers a completely different Japan. Its culture, history, and rhythm are distinct from the mainland, shaped by the former Ryukyu Kingdom and centuries of maritime trade. The result is a destination that feels softer, slower, and deeply grounded in nature.

We include Okinawa because it adds range and contrast to a Japan itinerary. It is ideal for travelers who want ocean, warmth, and space, but still value culture and quality. When curated well, Okinawa is not a generic beach stop. It becomes an immersion into island life, craft traditions, and a very specific sense of place.

Okinawa is best approached as an archipelago rather than a single destination. The main island offers convenience, excellent resorts, strong dining, and cultural depth, including key historical sites and museums. For travelers seeking a more remote, pristine experience, the outer islands deliver a different atmosphere entirely, with clearer water, quieter beaches, and a slower pace.

The region’s identity is one of its greatest strengths. Okinawa has its own food culture, music, and craft traditions, and it is worth engaging with them intentionally. Local cuisine is built around health and simplicity: island vegetables, pork, seaweed, tofu, and fermented flavors. Awamori distilleries, Ryukyu glass, and traditional textiles offer meaningful ways to connect with the culture beyond scenery.

Nature here is also specific. This is not dramatic coastline, but subtropical: coral reefs, mangroves, jungle-like forests, and luminous shallow water. We recommend balancing ocean time with one inland experience, such as a forest walk or cultural visit, to avoid the trip feeling one-dimensional.

Okinawa is at its best when paced slowly. Short drives, long mornings, and unstructured afternoons suit the climate and the lifestyle. The quality of the experience comes from choosing the right base, the right beach, and a few well-selected cultural moments rather than trying to cover too much.",Okinawa_RI,https://media.safariportal.app/store/asset/2140237/file/096b6c83f4cae0b4befe331ddc089012.jpg
Koyasan,Japan,Koyasan,"34.2132,135.586266",https://media.safariportal.app/store/asset/2140307/file/7437d39eaf35b79df5069c210ec334b7.jpg,,Why we recommend it,"Koyasan offers one of Japan’s most distinctive forms of immersion: a sacred mountain town where Buddhist practice is part of daily life. It is quiet, atmospheric, and deeply rooted, with a sense of stillness that feels immediate.

We include Koyasan because it provides cultural depth in a way that cannot be replicated elsewhere. It is not about sightseeing. It is about entering a different rhythm through temple stays, morning prayers, forest walks, and time without noise. When curated well, Koyasan becomes one of the most meaningful stops in Japan.

Koyasan is the center of Shingon Buddhism, founded by Kobo Daishi (Kukai) in the 9th century. Unlike many religious sites that feel separated from modern life, Koyasan remains an active spiritual community, with over one hundred temples, many of which host guests in shukubo (temple lodgings).

The experience here is defined by atmosphere. The mountain air, cedar forests, and early morning silence shape the feeling as much as the temples themselves. It is a place where details matter: the sound of footsteps on stone paths, incense drifting from halls, the ritual of vegetarian temple cuisine, the slow cadence of chanting at dawn.

Koyasan is best experienced overnight. A day trip can cover the highlights, but it misses the most important part: the evening calm after visitors leave, and the early morning when the town feels entirely devoted to practice and meditation. Staying in a temple also offers rare access to a form of hospitality that is both simple and highly refined, focused on intention rather than luxury.

We recommend a lightly structured visit. One or two major temple sites are enough. The rest of the value comes from time: walking through Okunoin, sitting quietly, and allowing the place to set the pace.",Koyasan_RI,https://media.safariportal.app/store/asset/2048584/file/2ed946f3340cd197041ba288116051fa.png
Kiso Valley,Japan,Kiso Valley,"35.694066,137.677706",https://media.safariportal.app/store/asset/2099320/file/e2129d8adac0c01fd4959e623c89f454.jpg,,Why we recommend it,"The Kiso Valley offers one of the most atmospheric ways to experience rural Japan. It is defined by old post towns, forested mountains, and the quiet rhythm of travel on foot. The setting feels preserved, but not staged.

We include the Kiso Valley because it connects travelers to Japan through place and pace. It is ideal for those who want history, nature, and craftsmanship in a setting that remains intimate. When curated well, the Kiso Valley becomes a refined slow-travel experience, with beautiful walks, simple regional meals, and nights that feel deeply restful.

The Kiso Valley was part of the Nakasendo, the historic route linking Kyoto and Edo. Its post towns developed to serve travelers, and that legacy remains in the architecture and layout: narrow streets, wooden facades, lattice windows, and small inns built around hospitality.

The most well-known section is the walk between Magome and Tsumago, but the valley’s value goes beyond that single route. The surrounding towns, forests, and local craft culture add depth, especially for travelers who prefer authenticity over spectacle. This region is also closely tied to traditional woodworking and lacquerware, and it offers a quieter, more tangible connection to craft than many urban shopping districts.

Kiso is best experienced overnight. Day trips can feel compressed, especially with train timing and crowds. A well-planned stay allows early morning streets before visitors arrive, slower walks, and the pleasure of returning to a warm inn. The experience becomes less about “seeing towns” and more about stepping into a historic travel rhythm.

We recommend keeping the itinerary simple here. One meaningful walk, one carefully chosen stay, and time to enjoy the atmosphere is often enough. The Kiso Valley is most powerful when it is not rushed.",KisoValley_RI,https://media.safariportal.app/store/asset/2048606/file/4c538fea6b9e8b68e02ab41d48e4cc81.png
Fukuoka,Japan,Fukuoka,"33.590184,130.401689",https://media.safariportal.app/store/asset/2140334/file/4249a58b4f4f98828541d528a8e4a45d.png,,Why we recommend it,"Fukuoka is one of Japan’s most livable cities, with a strong local identity and an exceptional food culture. It feels relaxed and open, but still delivers high quality in design, dining, and hospitality.

We include Fukuoka because it offers a version of Japan that is urban and refined without feeling formal. It is ideal for travelers who want excellent meals, walkable neighborhoods, and a city that feels local rather than touristic. When curated well, Fukuoka becomes a base for both culinary exploration and deeper Kyushu culture.

Fukuoka has long been Japan’s gateway to Asia, and the city reflects that history through its energy and food. It is compact and easy to navigate, with a coastal openness that makes it feel lighter than many major Japanese cities. The pace is calmer, and the lifestyle is more outdoors-oriented, especially around the river and seaside areas.

Dining is the most important lens here. Fukuoka is famous for Hakata ramen and yatai stalls, but the city’s food culture goes far beyond those icons. Seafood is outstanding, local ingredients are strong, and there is a serious counter-dining scene that remains less internationally saturated than Tokyo or Kyoto. The best approach is to balance one iconic food experience with a few carefully chosen smaller places that show range.

For cultural depth beyond the city center, Nanzoin Temple is one of the most worthwhile stops. It is known for its monumental reclining Buddha, but the real value is the setting and atmosphere: forested paths, quiet shrines, and a sense of scale that feels unexpected so close to the city. It offers a different lens on Kyushu’s spiritual culture and is especially rewarding when visited early.

Neighborhood choice shapes the trip. Tenjin is central and convenient, with shopping and strong restaurants. The Daimyo and Imaizumi areas offer a more design-forward city experience: small boutiques, cafés, galleries, and excellent casual dining. Nakasu and the riverside area are best for night atmosphere, while Momochi and the waterfront provide a calmer modern side.

Fukuoka also works well as a curated gateway into Kyushu. With the right planning, it connects smoothly to day trips and onward travel into craft towns, coastal areas, and hot spring regions.",Fukuoka_RI,https://media.safariportal.app/store/asset/2094301/file/4716c36f635184afd3ce5f7b493f0e9a.jpg
Kanazawa,Japan,Kanazawa,"36.559734,136.652038",https://media.safariportal.app/store/asset/2060722/file/106c43ebd4dcf883ce67d8b6ff7c5eba.jpg,,Why we recommend it,"Kanazawa offers one of Japan’s most refined cultural experiences in a city that still feels calm and intimate. It has the depth of a former castle town, with living craft traditions and a strong sense of aesthetics that feels distinctly Japanese.

We include Kanazawa because it delivers culture through quality rather than crowds. It is ideal for travelers who want gardens, architecture, and craftsmanship with a quieter pace. When curated well, Kanazawa becomes a place to slow down, learn, and invest in objects and experiences with provenance.

Kanazawa developed under the Maeda clan as a powerful castle town, and its legacy remains visible in the city’s structure, districts, and crafts. Unlike destinations that feel dominated by one major attraction, Kanazawa’s value comes from how its elements connect: the garden culture, the historic neighborhoods, the tea house districts, and the continued presence of artisans.

Craft is not an accessory here. It is part of daily life and cultural identity. Kanazawa is one of the best places in Japan to experience and acquire work with true lineage: gold leaf, lacquerware, ceramics, and dyed textiles such as Kaga Yuzen. The right visit can go beyond shopping and become cultural access, meeting makers and understanding technique.

The city is also beautifully walkable. Areas like Nagamachi retain the atmosphere of the former samurai district, while the Higashi Chaya area preserves a different Kyoto-like elegance with a stronger local character. Omicho Market adds a culinary layer, with seafood that reflects the Sea of Japan’s seasons. Kenrokuen Garden is the classic anchor, but Kanazawa is most rewarding when you balance the known sites with smaller museums, quiet streets, and time for craft.

Kanazawa suits a slower itinerary. One or two major cultural stops per day is enough. The most satisfying experience comes from leaving space for a long lunch, a museum visit chosen for your interests, and time with artisans rather than moving constantly.",Kanazawa_RI,https://media.safariportal.app/store/asset/2060715/file/7df0cbb13db487914c7384625e17a43e.jpg
Iya Valley,Japan,Iya Valley,"33.90472,133.92436",https://media.safariportal.app/store/asset/2140377/file/243a9e41245a553dbe786c474e2805fb.jpg,,Why we recommend it,"Iya Valley is one of Japan’s most remote and atmospheric landscapes. Deep gorges, mountain villages, and a slower rhythm create a feeling of Japan that is increasingly rare: quiet, rugged, and deeply rooted.

We include Iya because it offers true contrast and authenticity. It is ideal for travelers who want nature and culture without crowds, and who appreciate places that feel discovered rather than curated for visitors. When planned well, Iya becomes one of the most memorable parts of Japan, defined by scenery, simplicity, and a strong sense of place.

Iya is located in the mountains of Tokushima, on Shikoku. The geography is dramatic and the roads are winding, which is exactly why the valley has remained so preserved. The experience here is not about checking sights, but about moving slowly through the landscape and letting the setting lead.

The valley is known for traditional vine bridges and panoramic viewpoints, but its deeper value lies in its rural culture. Small hamlets, hillside agriculture, river life, and local food traditions shape the experience. Meals tend to be simple and seasonal, often featuring river fish, mountain vegetables, soba, and regional specialties.

Iya rewards travelers who stay overnight. A day trip rarely captures the atmosphere because distances are long and the best moments happen early or late, when the valley feels still. The most meaningful itineraries include a carefully chosen stay, a few short walks, and time to enjoy the scenery without constant movement.

Logistics matter in Iya. Transport options are limited, and weather can change quickly in the mountains. We recommend a curated route with realistic driving times, with space to stop when something feels beautiful rather than forcing a strict schedule.",IyaValley_RI,https://media.safariportal.app/store/asset/2119307/file/c91fe80fd8ee2c44c40f3742c1c7979b.jpg
