Area Name,Country,Location,GPS Coordinates,Primary Photo,Subheadline,Header,Description,Tags,Photos
Kumano Kodo,Japan,Kumano Kodo,"33.88852,136.100227",https://media.safariportal.app/store/asset/2094134/file/90309a9874640e9fdf0f91dee6e6c4fe.jpg,,Area Overview,"The Kumano Kōdō is a network of ancient pilgrimage routes weaving through the forested mountains of the Kii Peninsula, connecting the three sacred Kumano shrines. Used for over a thousand years by emperors, monks, and common pilgrims alike, the trails pass through cedar forests, mountain villages, waterfalls, and stone-paved paths shaped by centuries of travel.

Walking the Kumano Kōdō is as much a cultural experience as a physical one, with small inns, local cuisine, and onsen along the way offering moments of rest and reflection. Recognized as a UNESCO World Heritage Site, it appeals to travelers seeking history, spirituality, and immersion in Japan’s rural landscapes at a measured, contemplative pace.",KumanoKodo_Base,https://media.safariportal.app/store/asset/2094135/file/f995ca4b9a98d762c5b53524a8aa67b0.jpg
Fukuoka,Japan,Fukuoka,"33.590184,130.401689",https://media.safariportal.app/store/asset/2094301/file/4716c36f635184afd3ce5f7b493f0e9a.jpg,,Area Overview,"Fukuoka is a lively gateway to Kyushu that balances urban energy with an easygoing coastal rhythm. The city is compact and walkable, with contemporary architecture, riverside promenades, and beaches close to the center. Its food culture is a major draw, from open-air yatai stalls serving ramen and grilled dishes to refined restaurants showcasing Kyushu’s regional produce.

Beyond the city core, Fukuoka offers quick access to historical sites such as Dazaifu Tenmangū and natural escapes along the Itoshima coast. Well-connected and less frenetic than Japan’s larger cities, it suits travelers looking for a modern Japanese city with a relaxed pace and strong local character.",Fukuoka_Base,https://media.safariportal.app/store/asset/2094302/file/59631b080325be6f6506a843a11e31ed.jpg
Ishigaki,Japan,Ishigaki,"24.337859,124.178419",https://media.safariportal.app/store/asset/2094312/file/1a346c33ee7c57ddc120b9c8ab62df6c.jpg,,Area Overview,"Ishigaki is the main island of the Yaeyama archipelago, known for its clear waters, coral reefs, and subtropical landscapes. Life here revolves around the sea, with snorkeling, diving, and boat trips to nearby islands forming the core of the experience. The island also has a strong local food culture, featuring Ishigaki beef, tropical fruits, and Okinawan specialties.

Away from the coastline, the interior reveals mangroves, small farms, and quiet viewpoints, while evenings are low-key and centered around local eateries. Ishigaki appeals to travelers seeking nature, warm weather, and a slower island rhythm, with just enough infrastructure to stay comfortable without feeling overdeveloped.",Ishigaki_Base,https://media.safariportal.app/store/asset/2094322/file/d33e6cab2f2108726bc4db1dcbe7c2b1.jpg
Kiso Valley,Japan,Kiso Valley,"35.694066,137.677706",https://media.safariportal.app/store/asset/2099320/file/e2129d8adac0c01fd4959e623c89f454.jpg,,Area Overview,"The Kiso Valley stretches through the mountains of central Japan, following the upper reaches of the Kiso River and preserving the atmosphere of an old travel corridor. Once part of the Nakasendō route linking Kyoto and Edo, the valley is defined by forested slopes, clear streams, and a series of post towns that retain a strong sense of continuity and place.

Walking routes connect villages such as Magome and Tsumago, where wooden townhouses, stone paths, and rural landscapes shape a slow, linear journey. The valley invites unhurried travel, on foot or by local train, revealing a quieter Japan where history, nature, and everyday life remain closely aligned.",KisoValley_Base,https://media.safariportal.app/store/asset/2099322/file/6fc6766ea7c069c55af76a0f75903bed.jpg
Matsuyama,Japan,Matsuyama,"33.835512,132.763992",https://media.safariportal.app/store/asset/2099264/file/eab95778c5ef78031e60b08de9994ed4.jpg,,Area Overview,"Matsuyama, on Japan’s island of Shikoku, balances a compact urban core with access to coastal scenery and thermal traditions. The city’s rhythm is shaped by its history as a castle town, centered on Matsuyama Castle, which overlooks grid-like streets, local markets, and cafés that extend toward the Seto Inland Sea.

Matsuyama is also known for Dōgo Onsen, one of Japan’s oldest bathhouses, where daily life and ritual bathing remain intertwined. Beyond these anchors, nearby beaches, parks, and rivers offer quiet outdoor time, and the surrounding countryside reveals a softer side of Ehime Prefecture’s landscape and seasonal change.","",https://media.safariportal.app/store/asset/2099266/file/f752cf87529cb4a5f55fa1576138e94c.jpg
Nagoya,Japan,Nagoya,"35.181451,136.906557",https://media.safariportal.app/store/asset/2099281/file/9d6cb84cd837e2d255bf787fa658711e.jpg,,Area Overview,"Nagoya is a dynamic city in central Japan where industry, design, and history intersect. Its compact center combines contemporary architecture and transit ease with long-standing cultural sites, from Nagoya Castle to local museums and traditional festivals, reflecting both historical depth and modern growth.

The city’s neighborhoods offer a mix of everyday life and urban culture (markets, cafés, craft workshops, and food streets) that anchor daily rhythms without overwhelming scale. Nagoya’s location also makes it a practical base for exploring nearby valleys, coastlines, and historic towns, connecting mainstream transport with quieter regional layers of the Chūbu region.","",https://media.safariportal.app/store/asset/2099285/file/6d1e6b1e944965ca6a0cb676329f9a50.jpg
Miyajima,Japan,Miyajima,"34.273211,132.305249",https://media.safariportal.app/store/asset/2099301/file/72b72a2b91a4a7f6ce4aa4e85f566198.jpg,,Area Overview,"Miyajima, formally known as Itsukushima, is a tidal island in the Seto Inland Sea best known for its iconic floating torii and the shrine complex that frames sea and mountain together. The island’s paths, forested slopes, and coastal views create a compact landscape where daily life, pilgrimage, and scenery coexist.

Away from the shrine precincts, Miyajima’s streets are lined with small shops, cafés, and ryokan, while trails lead up into wooded hills and viewpoints. The island’s pace is quiet and walkable, inviting extended walks at sunrise or dusk when the interplay of tide, light, and stone enriches the experience beyond any single landmark.","",https://media.safariportal.app/store/asset/122315/file/0d5733b508af12f4149ab392ed1df695.jpg
Seoul,Korea,Seoul,"37.550263,126.997083",https://media.safariportal.app/store/asset/2106978/file/fa692b56439b3b36c955efc6a0b3eff0.jpg,,Area Overview,"Seoul is a city where ancient palaces rise against a skyline of glass towers, a seamless blend of old and new that few places in the world can match. The capital of South Korea pulses with creative energy, from its cutting-edge fashion and design scene to the innovative cuisine that has made it a global dining destination.

Yet beneath the neon and high-tech façade, Seoul’s soul lies in its traditions. You can still stroll through tranquil hanok villages, watch the changing of the guard at Gyeongbokgung Palace, or find serenity in the quiet temples of the city’s mountains.

It’s a city of contrasts, street food markets buzzing until dawn, minimalist galleries tucked into quiet alleys, and a music scene that stretches from underground clubs to the global stage of K-pop. To truly experience Seoul, follow its rhythm: sip matcha in Bukchon, shop emerging designers in Hannam or Seongsu, and end the night at a rooftop bar overlooking the Han River, a perfect reflection of a city that never stops reinventing itself.",Seoul_Base,https://media.safariportal.app/store/asset/2107010/file/f56395af6a432e6e97ab5ea3e4df31a7.jpg
Yakushima,Japan,Yakushima,"30.344594,130.512714",https://media.safariportal.app/store/asset/2113201/file/5b5ee4161ebf4556a69fb4aeb990c85d.png,,Area Overview,"Yakushima Island, located in Japan, is renowned for its stunning natural landscapes and rich biodiversity. This UNESCO World Heritage site is famous for its ancient cedar trees, some of which are over a thousand years old, creating a mystical atmosphere that attracts nature lovers and hikers from around the globe.

The island offers a variety of outdoor activities, including hiking through the lush forests of Yakusugi Land and trekking the famous Shiratani Unsuikyo Ravine, which inspired the Studio Ghibli film ""Princess Mononoke."" The trails range from easy walks to challenging hikes, catering to all levels of experience.

In addition to its hiking opportunities, Yakushima is home to unique wildlife, including the Yakushima macaque, a subspecies of Japanese macaque, and the endangered loggerhead sea turtles that nest on its shores. Birdwatchers will also delight in spotting various species that inhabit the island.

The island's climate is humid and subtropical, making it a year-round destination, although the best time to visit is during the spring and autumn months when the weather is mild and the scenery is particularly beautiful.

For those looking to explore beyond Yakushima, nearby Yakushima National Park offers additional opportunities for adventure and exploration. Additionally, the island's rich cultural heritage can be experienced through local festivals and traditional crafts.","",https://media.safariportal.app/store/asset/2113199/file/2909b6f1fdcd090aaf5d97b97a900b16.png
Iya Valley,Japan,Iya Valley,"33.90472,133.92436",https://media.safariportal.app/store/asset/2119305/file/ee7c00f1c408b4811dbf6c6116e3ad34.jpg,,Area Overview,"Tucked deep in the mountains of Tokushima on Shikoku, the Iya Valley is one of Japan’s most remote and dramatic landscapes, shaped by steep gorges, dense forest, and clear river valleys. Long known as a refuge region, it retains a strong sense of distance from urban Japan, where nature and terrain still define daily life.

The valley is best experienced slowly, through scenic drives, short walks, and time spent at viewpoints, vine bridges, and riverside villages. Highlights include the Kazurabashi vine bridges, traditional thatched-roof homes, and onsen stays with views into the gorge. With its quiet pace and powerful scale, Iya offers a rare side of Japan focused less on monuments and more on landscape, tradition, and stillness.",IyaValley_Base,https://media.safariportal.app/store/asset/2119304/file/2df2358cf6702cf4d7c2955e8b08eb0f.jpg
Takayama,Japan,Takayama,"36.146132,137.252159",https://media.safariportal.app/store/asset/2115472/file/9a8b2b905af1f2792883d4033f13aa5b.png,,Area Overview,"Takayama is a delightful city in the Japanese Alps, known for its well-preserved district from the Edo period; back in the nights when it was a rich trading city. The traditional cityscape is unique in Japan.

Takayama is the center of the Hida region, the home of cows of the special Hida breed. Hida meat is less well known abroad than Kobe beef, but it is perhaps even better.

Takayama has traditionally been best known for architectural expertise; in particular, woodworking and furniture making. For example, it was carpenters from Takayama who worked on the Imperial Palace in Kyoto and many of the temples in Kyoto and Nara in the distant past. There is also very nice sake brewery in the center.

Takayama is a fairly small town, with a compact center containing several hotels, restaurants, stores and small eateries. There is a fantastic and especially friendly atmosphere.","",https://media.safariportal.app/store/asset/2115498/file/a7e12f4e3cbb02a9cf3f3562f7b0b43f.png
Shuzenji,Japan,Shuzenji,"34.972615,138.933036",https://media.safariportal.app/store/asset/2123544/file/653cd86b85e7a96d70c02d179a273b2d.png,,Area Overview,"Shuzenji Onsen, located in the picturesque town of Shuzenji in Japan, is one of the country's most celebrated hot spring resorts. Nestled in the lush mountains of Shizuoka Prefecture, this onsen is renowned for its tranquil atmosphere and beautiful natural surroundings, making it a perfect getaway for those seeking relaxation and rejuvenation.

The history of Shuzenji Onsen dates back over 1,200 years, and it is said to have been discovered by a monk named Kōbō Daishi. Today, visitors can enjoy a variety of traditional ryokan (Japanese inns) that offer onsen baths, allowing guests to soak in the mineral-rich waters that are believed to have healing properties.

Apart from its soothing hot springs, Shuzenji Onsen is also home to several attractions. The Shuzenji Temple, with its stunning architecture and serene gardens, is a must-visit for those interested in Japanese culture and history. The area is also famous for its scenic walking paths, such as the picturesque bamboo forest and the charming riverbank promenade, which provide a serene backdrop for leisurely strolls.

For travelers looking to explore beyond the onsen, the surrounding Izu Peninsula offers beautiful coastlines, hiking trails, and other hot springs. Nearby attractions include the scenic coastline of Atami and the vibrant city of Ito, both of which are easily accessible from Shuzenji.","",
Daisetsuzan,Japan,Daisetsuzan,"43.685066,142.806308",https://media.safariportal.app/store/asset/2123628/file/362f94df500deeab417b1d9b56e33ebe.png,,Area Overview,"Venture into the heart of Hokkaido’s largest national park, Daisetsuzan, where summer unveils a breathtaking expanse of alpine meadows, steaming volcanic peaks, and pristine wilderness. Often called the ""Roof of Hokkaido,"" this rugged paradise invites adventurers to explore its towering mountains, crystal-clear rivers, and lush highlands teeming with life.

Nature lovers will be captivated by the ethereal beauty of Ginsendai and Tenninkyo Gorge, where emerald forests give way to cascading waterfalls and panoramic vistas. As you journey through the park, immerse yourself in the serenity of hidden onsen retreats, where soothing thermal waters provide the perfect end to a day of adventure.

For those who seek both challenge and tranquility, Daisetsuzan in summer is an invitation to experience the raw, untamed beauty of Hokkaido’s true wilderness.","",
Hokkaido,Japan,Hokkaido,"43.220327,142.863474",https://media.safariportal.app/store/asset/2123630/file/e43e8d1f668280fcd0be39013790a20e.png,,Area Overview,"Unleash your inner adventurer in Hokkaido, Japan’s vast and captivating northern island, where summer brings a paradise of untamed natural beauty. Explore the breathtaking national parks of eastern Hokkaido, a haven for nature lovers traveling by camper.
Immerse yourself in vibrant wildflower meadows, endless green forests, and pristine lakes that reflect the serene sky. 

Wander through the rugged volcanic landscapes of Akan-Mashu National Park, home to crystal-clear caldera lakes and the famous marimo moss balls. Witness the untouched beauty of Shiretoko National Park, a UNESCO World Heritage site, where dramatic cliffs meet the sparkling Sea of Okhotsk, and wildlife like deer, foxes, and brown bears roam freely.","",
Lake Akan,Japan,Lake Akan,"43.457258,144.104015",https://media.safariportal.app/store/asset/2123639/file/9d9ae9a04f54bfe251e0d81ddaa686bd.png,,Area Overview,"Immerse yourself in the mystical beauty of Akan-Mashu National Park, where volcanic landscapes, crystal-clear lakes, and ancient Ainu culture create an unforgettable summer escape. Nestled in eastern Hokkaido, Lake Akan, Lake Mashu, and Lake Kussharo reflect the deep blue skies, their pristine waters surrounded by rolling forests and dramatic peaks.

Wander along Lake Mashu, one of the clearest lakes in the world, shrouded in an air of mystery as morning mists dance over its glassy surface. Experience the otherworldly sight of bokke; boiling mud pools that bubble and hiss, revealing the volcanic heartbeat of the region.

Beyond nature’s wonders, Akan is home to the Ainu, the indigenous people of Hokkaido. In Akan Kotan, witness traditional Ainu dance performances, intricate wood carvings, and spiritual connections to the land that have been passed down for generations.","",
Shiretoko,Japan,Shiretoko Japan,"44.199656,145.239674",https://media.safariportal.app/store/asset/2123669/file/69cabeb71669929773edfe4f8743845d.png,,Area Overview,"Journey to Shiretoko Peninsula, Japan’s last true wilderness and a UNESCO World Heritage Site, where unspoiled nature and abundant wildlife create a breathtaking summer retreat. Located in eastern Hokkaido, Shiretoko National Park is a land of rugged mountains, ancient forests.

For wildlife enthusiasts, Shiretoko is a paradise; spot Ezo deer grazing in flower-filled meadows, Steller’s sea eagles soaring above cliffs, and even brown bears fishing along remote rivers. Embark on a cruise along the peninsula’s coastline, where you may encounter pods of dolphins and orcas gliding through the crystal-clear waters of the Okhotsk Sea.

As the day ends, relax in a secluded rotenburo onsen, surrounded by the untamed beauty of the peninsula. In Shiretoko, summer is a season of pure adventure, where nature reigns supreme and every moment feels like a discovery in the wild heart of Hokkaido.","",
Imabari,Japan,Imabari,"34.066202,132.997791",https://media.safariportal.app/store/asset/2131214/file/fb7eeab665f7554b50723956d81fbafc.png,,Area Overview,"Imabari (Ehime Prefecture) is a relaxed port city on Shikoku best known as the main gateway to the Shimanami Kaidō, the scenic island-hopping route linking Shikoku to Honshu. It’s a place where daily life still feels local and unhurried, with sea views, small fishing harbors, and easy access to Setouchi’s artful, coastal landscapes.

Beyond cycling, Imabari has a strong identity tied to shipbuilding and Imabari towels, one of Japan’s most respected textile industries, making it a good stop for travelers interested in craft, design, and regional culture. It also works well as a base for exploring nearby islands, quiet beaches, and inland temple routes at a slower pace.","",https://media.safariportal.app/store/asset/2131223/file/4f90824df70a4e447c202e67463e1824.png
Tokyo,Japan,Tokyo,"35.676423,139.650027",https://media.safariportal.app/store/asset/1258804/file/1e907907b4b52a8d4888c62e3d784b38.jpg,,Why we recommend it ,"Tokyo is Japan’s most complete introduction. It holds tradition and modernity side by side, without performance. For first-time visitors, it provides context. For returning travelers, it rewards depth.

We include Tokyo because it is where Japan’s values become tangible: precision, craft, restraint, and quiet service. When curated properly, Tokyo is not overwhelming. It becomes one of the most refined cities to experience slowly.

Tokyo is not one city. It is a collection of highly distinct neighborhoods, each with its own rhythm, aesthetics, and social code. The key to enjoying Tokyo is not trying to cover it all, but choosing the right districts for your style of travel, then allowing time for the city to reveal itself through small moments: a perfect coffee bar, a knife shop with generations of history, a quiet shrine hidden behind office towers.

Tokyo’s luxury is often discreet. It is found in details rather than statements: the precision of service, the calm choreography of a restaurant, the obsessive specialization of a craft shop. Even at the highest level, Tokyo rarely feels showy. 

Dining in Tokyo is not only exceptional, it is uniquely structured. Many of the best experiences come from places that do one thing with absolute mastery, often in intimate settings. A sushi counter, a tempura specialist, a soba shop, a yakitori chef with a single menu. This focus on mastery shapes the entire culinary culture and makes Tokyo one of the most rewarding food cities in the world when curated thoughtfully.

Shopping here is also cultural. Tokyo is one of the best places in Japan to invest in objects that will last: ceramics, lacquerware, knives, textiles, denim, incense, stationery, and tea. The difference is not only design, but provenance. The right store will explain the craft, the region, the maker, and how to care for the object. It turns shopping into a form of cultural access.

We recommend experiencing Tokyo in layers rather than as a checklist. One main district per day is often enough. The most memorable Tokyo itineraries include intentional contrast: a high-energy neighborhood balanced with a quiet one, a museum morning followed by small streets and local cafés, a formal dinner paired with something simple and perfect the next day.",Tokyo_RI,https://media.safariportal.app/store/asset/1258803/file/46ab8568615c7d0bd0b9085931f98cc9.jpg
Kyoto,Japan,Kyoto,"35.011564,135.768149",https://media.safariportal.app/store/asset/2056790/file/061f6db8701e3ff00bee21745062346b.jpg,,Why we recommend it,"Kyoto is Japan’s cultural memory. It offers a depth of tradition that is not recreated or curated for visitors. It is lived, protected, and continuously refined.

We include Kyoto because it provides what no other destination can: a direct connection to Japan’s aesthetics, rituals, and craftsmanship. When planned well, Kyoto is not about rushing through temples. It becomes an immersion into detail, seasonality, and quiet beauty.

Kyoto is best experienced through intention and pacing. Many of its most important places are subtle, and the city reveals itself slowly through atmosphere: early morning streets, incense in temple corridors, the sound of water in a garden, a simple meal served with precision.

Unlike Tokyo, Kyoto’s luxury is often invisible. It appears in restraint: the quality of materials, the calm of a space, the thought behind a gesture. The most meaningful experiences here are not necessarily the most famous, but the most considered.

Kyoto is also a city of micro-neighborhoods, each offering a different lens. Higashiyama holds the classic Kyoto image: slopes, wooden lanes, and historic temples. Arashiyama offers nature, riverside scenery, and some of the city’s most elegant ryokan experiences. Downtown Kyoto and Karasuma provide access to refined dining, shopping, and contemporary craft. Areas like Okazaki bring museums and a more residential, cultural rhythm. The key is selecting the right combination for your travel style, then leaving space for unplanned discovery.

We recommend experiencing Kyoto early and late, with lighter afternoons. The city is at its best before crowds arrive: quiet temple visits, private gardens, morning tea, and slow walks. A well-curated Kyoto itinerary balances iconic sites with smaller spaces, and pairs cultural immersion with moments of rest.",Kyoto_RI,https://media.safariportal.app/store/asset/122093/file/27f2370e1328a4658dd8b9a4ff6b7d5d.jpg
Osaka,Japan,Osaka,"34.693725,135.502253",https://media.safariportal.app/store/asset/2056764/file/66ff89258fbdf5d989f9962f80ec75de.jpg,,Why we recommend it,"Osaka is Japan at its most open and alive. It is direct, energetic, and deeply local, with a culture built around food, humor, and hospitality.

We include Osaka because it offers a different kind of refinement: not formal, but highly skilled. Osaka rewards travelers who value atmosphere and craft over ceremony. When curated well, it becomes one of Japan’s most enjoyable cities for dining, nightlife, and street-level culture, without losing quality.

Osaka developed as a merchant city, and that history still defines its character. It is practical, confident, and built around people. The culture here is less about quiet perfection and more about warmth and immediacy, which makes it feel approachable even at a high-end level.

Food is the most important lens for understanding Osaka. This is not only a city of casual specialties. It is a place where ingredient quality and technique are taken seriously across all tiers, from street stalls to counter dining. Osaka’s best experiences often come from well-chosen small places: a chef who does one dish perfectly, a long-running local institution, a counter with regulars.

The city is best explored by district. Namba and Dotonbori are iconic for atmosphere, but are most enjoyable in short, well-timed visits. Umeda is polished and modern, ideal for refined hotels, department stores, and excellent dining. Tenma and the streets near Tenjinbashisuji offer a more local rhythm with outstanding casual food culture. Nakazakicho brings a quieter creative side with cafés, vintage shops, and small galleries. Kitahama and the riverfront areas feel calmer and more architectural, with strong coffee culture and elegant pockets.

We recommend experiencing Osaka in the late afternoon into night, when the city’s energy becomes part of the experience. A well-curated Osaka day focuses on a few excellent stops rather than covering large distances.",Osaka_RI,https://media.safariportal.app/store/asset/168321/file/5a0509b5b4b1e624e67c20ac8f77fa5e.jpg
