Area Name,Country,Location,GPS Coordinates,Primary Photo,Subheadline,Header,Description,Tags,Photos
Hakone,Japan,Hakone,"35.233769,139.108845",https://media.safariportal.app/store/asset/2056670/file/143029e07455db3c38b6f764bf43a7aa.jpg,,Area Overview,"Hakone, located in Japan, is a picturesque area renowned for its stunning natural landscapes and rich cultural heritage. Nestled in the Fuji-Hakone-Izu National Park, Hakone is famous for its hot springs, or onsen, which attract visitors seeking relaxation and rejuvenation. The area offers breathtaking views of Mount Fuji, especially from locations like Lake Ashi, where you can enjoy serene boat rides amid the scenic backdrop.

In addition to its natural beauty, Hakone is home to several cultural attractions. The Hakone Open-Air Museum showcases a variety of sculptures set against the lush greenery, providing a unique blend of art and nature. Visitors can also explore the historic Hakone Shrine, which is located by the lake and features a striking torii gate that appears to float on the water.

For those interested in traditional Japanese experiences, Hakone offers ryokan (Japanese inns) where guests can immerse themselves in local customs while enjoying kaiseki cuisine. The area is also well-connected by the Hakone Tozan Railway, making it easy to travel to nearby attractions, including the charming town of Gora and the scenic Owakudani volcanic valley.

Whether you are looking to unwind in an onsen, explore art and history, or take in the stunning views, Hakone provides a diverse range of activities that cater to all types of travelers. Its combination of natural and cultural experiences makes it a must-visit destination in Japan.",Hakone_Base,https://media.safariportal.app/store/asset/2056659/file/f70030db06231577ae8b5c74879aa755.jpg
Hiroshima,Japan,Hiroshima,"34.385289,132.455306",https://media.safariportal.app/store/asset/122311/file/250064acaf139bc75ff04075db2ab1d0.jpg,,Area Overview,"Hiroshima is a city that carries the weight of history with grace, transforming its past into a message of peace and renewal. While forever linked to the events of 1945, Hiroshima today is a vibrant, forward-looking city that embraces life while honoring its past. A visit to the Peace Memorial Park and Museum is a deeply moving experience, a reminder of both tragedy and the resilience of the human spirit.

But Hiroshima is not just about remembrance; it is also a city of culture, nature, and incredible food. Wander through Shukkeien Garden, an oasis of tranquility where time slows down among meticulously landscaped ponds and tea houses.

Whether reflecting on history, exploring cultural gems, or indulging in its culinary delights, Hiroshima leaves a lasting impression, one of strength, hope, and a deep appreciation for life.","",https://media.safariportal.app/store/asset/122314/file/7fc6bbbc1ff88999646a12846e333622.jpg
Himeji,Japan,Himeji,"34.815418,134.685551",https://media.safariportal.app/store/asset/2056633/file/a870da4cefb18116291eaf52950914bf.jpg,,Area Overview,"Himeji is a city defined by clarity, proportion, and endurance. At its center stands Himeji Castle, Japan’s most perfectly preserved feudal castle and a masterwork of wooden architecture. Rising above the surrounding city with remarkable lightness and precision, it is less a symbol of power than an expression of balance, strategy, and refined craftsmanship.

Beyond the castle, Himeji reveals a quieter elegance. The nearby Kōko-en Gardens offer a carefully composed counterpoint, where enclosed landscapes, water, and stone create moments of intimacy and pause. Walking these grounds allows for an appreciation of how architecture and garden design work together to shape perception and movement.

Himeji leaves an impression of restraint and continuity. It is a place where history has not been overlaid or reinterpreted, but carefully maintained, offering a rare opportunity to encounter Japan’s architectural heritage in its most lucid and unadorned form.","daytrip, Himeji castle",https://media.safariportal.app/store/asset/2056628/file/fdd21f60392dda3f539a9ed20fa1b9a3.jpg
Kamikochi,Japan,Kamikochi,"36.248754,137.638065",https://media.safariportal.app/store/asset/2053398/file/25d96811bee72e011e34335659297ce1.png,,Area Overview,"Kamikochi is undoubtedly one of Japan's most breathtaking natural treasures. Nestled in the heart of the northern Japanese Alps, this stunning region offers a series of mountain panoramas that are nothing short of spectacular. The dramatic landscapes, with their towering peaks and crystal-clear waters, create a scene so perfect it feels like a fairytale.

This is a place where nature's beauty is on full display. The pristine rivers, serene lakes, and majestic mountains come together to form a landscape that is unmatched in its splendor. Kamikochi is a destination that truly captivates the heart, offering an unparalleled experience for those who seek the purest connection with nature.

Whether you're walking among the towering trees or hiking along the scenic trails, a visit to Kamikochi is an unforgettable journey into the wild beauty of Japan. It's a place where nature lovers can immerse themselves in the tranquility and majesty of one of the country's most stunning regions. Keep in mind: challenging hikes and more basic stays, but believe us its worth it!",Kamikochi_Base,https://media.safariportal.app/store/asset/2056590/file/bc516d02e564b20e6d8b414d99c2735c.jpg
Naoshima,Japan,Naoshima,"34.459917,133.995244",https://media.safariportal.app/store/asset/192846/file/11b1f318414f6b2a56da16afa8f0c874.jpg,,Area Overview,"A ""must"" visit, Naoshima is a small island in Japan's truly magnificent Seto Inland Sea. As the location of the Benesse Art Site, it has become one of the biggest draws in the region, offering a unique opportunity to admire some of Japan's best contemporary artworks in a beautiful natural setting.

The Benesse project began in the early 1990s, when the Benesse Corporation chose Naoshima as the site for its growing collection of modern art. Since then, the island has continued to change. Once inhabited by a dwindling population living off the proceeds of fishing, it now has several first-rate art galleries and installations and has attracted creatives from around the country to set up businesses there.

The art initiative has not been limited to the Naoshima coast, with museums and art venues popping up on other islands in the Inland Sea. Yayoi Kusama's yellow pumpkin has since become a symbol of Naoshima. The nearby island of Teshima (a wonderful 20-minute ferry ride away) also has a collection of works of art to make a day trip worth wile.",Naoshima_Base,https://media.safariportal.app/store/asset/2056564/file/8694a1b98061c870d8d2f018d0e18608.jpg
Shimanami Kaido,Japan,Setoda,"34.305211,133.086247",https://media.safariportal.app/store/asset/2056545/file/b484d917e19be130f14ef9565207b0d4.jpg,,Area Overview,"Shimanami Kaido is a spectacular area for cycling that originally begins on the Japanese island of Honshu and ends on the island of Shikoku. The route includes a series of ten bridges connecting the islands and offers stunning views of the beautiful Seto Inland Sea. The total bike ride is about 70 kilometers long but there are several leisurely rides optional from the small charming town of Setoda. In case you like to complete the 70km in 1 / 2 days that is also possible. 

The views of the sea and surrounding mountains are fantastic throughout. You'll make stops at quaint fishing villages and fascinating sights. From here you can take a day trip to Hiroshima. For most people, of course, Hiroshima is synonymous with one event. The city's name will always evoke memories of Aug. 6, 1945, when Hiroshima was the target of the world's first atomic bomb attack.",ShimanamiKaido_Base,https://media.safariportal.app/store/asset/2056543/file/f6bb385754bec086f78467691bf7dbb8.jpg
Aonagi,Japan,Setouchi Retreat,"33.922915,132.817031",https://media.safariportal.app/store/asset/2056535/file/e300059ee3bc007e0f4514eea50b5b06.jpg,,Area Overview,"A two-night stay at Setouchi Retreat Aonagi promises a rejuvenating experience amidst the stunning natural beauty of Japan's Setouchi region. Nestled in the serene landscape of Aonagi, this retreat offers a perfect blend of luxury and tranquility, making it an ideal getaway for those seeking relaxation and exploration.

During your stay, you can indulge in various wellness activities, including traditional Japanese onsen baths, yoga sessions, and spa treatments that utilize local ingredients. The retreat's design harmonizes with the surrounding nature, allowing guests to unwind while enjoying breathtaking views of the Seto Inland Sea.

Dining at the retreat will be a highlight, featuring locally sourced ingredients that reflect the flavors of the Setouchi region. You might savor exquisite kaiseki meals that showcase seasonal produce and seafood, enhancing your culinary journey during your stay.","",https://media.safariportal.app/store/asset/2053555/file/31b58faecd68056f727c1d360947d8d8.png
Koyasan,Japan,Koyasan,"34.2132,135.586266",https://media.safariportal.app/store/asset/2048584/file/2ed946f3340cd197041ba288116051fa.png,,Area Overview,"Koyasan is a remote and picturesque mountain village located and a spiritual centre of Buddhism and home to hundreds of temples.
A visit to Koyasan is an unforgettable experience for anyone interested in Buddhism, Japanese culture and the natural beauty of Japan. It is a peaceful and contemplative destination where you can enjoy a unique spiritual atmosphere while relaxing amidst beautiful nature.

Activities:
Temple Stay
Okunoin Cemetery Night Tour
Hiking through mountainous surroundings with beautiful temples (UNESCO World Heritage Site)",Koyasan_Base,https://media.safariportal.app/store/asset/2056496/file/89647892642d686c5b8ad465d9c6f167.jpg
Tokyo,Japan,Tokyo,"35.676423,139.650027",https://media.safariportal.app/store/asset/102345/file/399562e1de5d0f96adbc411da7871a14.jpg,,Area Overview,"Tokyo, the bustling capital of Japan, is a vibrant metropolis that seamlessly blends traditional culture with cutting-edge modernity. Known for its iconic skyline, Tokyo boasts landmarks such as the historic Senso-ji Temple in Asakusa, the towering Tokyo Skytree, and the fashionable streets of Shibuya and Harajuku. 

Visitors can immerse themselves in the city's rich history at the Imperial Palace or explore the serene gardens that offer a peaceful retreat from the urban pace. The city's diverse neighborhoods each have their own unique charm, from the neon-lit streets of Akihabara, known for its otaku culture, to the upscale shopping districts of Ginza.

Culinary enthusiasts will find a paradise in Tokyo, with an array of dining options ranging from Michelin-starred restaurants to local izakayas serving delicious street food. The city's vibrant nightlife, cultural festivals, and art scenes further enhance its appeal, making Tokyo a must-visit destination for travelers seeking an unforgettable experience. 

Whether you're exploring ancient temples, indulging in sushi, or enjoying the latest in pop culture, Tokyo promises a unique adventure for every type of traveler.",Tokyo_Base,https://media.safariportal.app/store/asset/2056708/file/87801edcaddc92a73c29c8e2e6a77805.jpg
Osaka,Japan,Osaka,"34.693725,135.502253",https://media.safariportal.app/store/asset/2056764/file/66ff89258fbdf5d989f9962f80ec75de.jpg,,Area Overview,"Osaka, Japan's vibrant metropolis, is renowned for its rich history and dynamic culture. As the third-largest city in Japan, it serves as a bustling hub that effortlessly blends modernity with tradition. Visitors can explore historic landmarks like Osaka Castle, which stands as a testament to the city's feudal past, while also enjoying the contemporary architecture and lively atmosphere of districts such as Namba and Umeda.

Culinary enthusiasts will find Osaka to be a paradise for food lovers, often referred to as the ""Kitchen of Japan."" The city is famous for its street food, offering a delightful array of local specialties such as takoyaki (octopus balls) and okonomiyaki (savory pancakes). The bustling Dotonbori district is a must-visit for those looking to indulge in these culinary delights, where neon lights and the sound of sizzling food create an unforgettable dining experience.

Beyond its food scene, Osaka boasts a range of attractions that cater to all interests. Families can enjoy a day at Universal Studios Japan, while history buffs can delve into the city's past at the Osaka Museum of History. Additionally, the nearby Osaka Aquarium, one of the largest in the world, offers a fascinating glimpse into marine life. With its unique blend of culture, cuisine, and entertainment, Osaka is a destination that promises to leave a lasting impression on every traveler.",Osaka_Base,https://media.safariportal.app/store/asset/1258782/file/ffb95b7d06ddcb47f828b2e9ee6f4d5a.jpg
Kyoto,Japan,Kyoto,"35.011564,135.768149",https://media.safariportal.app/store/asset/2056790/file/061f6db8701e3ff00bee21745062346b.jpg,,Area Overview,"Kyoto, the ancient capital of Japan, is a city where history and tradition come alive. Nestled in the lush hills of the Kansai region, this enchanting destination is renowned for its well-preserved temples, stunning gardens, and vibrant cultural heritage. 

As you stroll through the streets of Kyoto, you'll encounter iconic landmarks such as the Kinkaku-ji, or the Golden Pavilion, with its shimmering gold leaf reflecting beautifully on the surrounding pond. The Arashiyama Bamboo Grove offers a serene escape, where towering bamboo stalks create a magical atmosphere that feels otherworldly.

Kyoto is also famous for its traditional tea houses and geisha culture. Visiting the historic Gion district provides an opportunity to witness the elegance of geisha performances and enjoy authentic kaiseki dining, a multi-course meal that showcases seasonal ingredients and exquisite presentation.

For nature lovers, the cherry blossoms in spring and vibrant autumn leaves create breathtaking landscapes, making Kyoto a year-round destination. The city's numerous shrines and temples, such as Fushimi Inari Taisha with its thousands of vermilion torii gates, offer both spiritual solace and a glimpse into Japan's rich past.

With its blend of cultural experiences, natural beauty, and culinary delights, Kyoto remains a must-visit destination for travelers seeking to immerse themselves in the heart of Japan's heritage. Whether exploring ancient sites or enjoying a quiet moment in a traditional garden, Kyoto promises unforgettable memories for every visitor.",Kyoto_Base,https://media.safariportal.app/store/asset/2056794/file/fc28b9a3643f2de4b08235fe73740c08.jpg
Kamakura,Japan,Kamakura,"35.319213,139.546673",https://media.safariportal.app/store/asset/2056871/file/daaed27ce72a67a67cb7923b6a65d5da.jpg,,Area Overview,"Kamakura, a coastal gem located just south of Tokyo, is a destination that beautifully blends rich history with stunning natural scenery. Known as the birthplace of the samurai culture, this charming city is home to numerous temples, shrines, and the iconic Great Buddha, or Daibutsu, which stands majestically at 13.35 meters. Visitors can immerse themselves in the serene atmosphere of Hase-dera Temple, famous for its beautiful gardens and views of the ocean, or explore the ancient pathways lined with traditional wooden houses that echo the past.

Beyond its historical landmarks, Kamakura is surrounded by lush mountains and offers breathtaking coastal views, making it a haven for outdoor enthusiasts. The city's beaches, such as Yuigahama and Zaimokuza, are perfect for sunbathing, surfing, or simply enjoying a peaceful sunset. The nearby hiking trails, like the one leading to the scenic Komachi Street, provide a delightful opportunity to experience the region's natural beauty while discovering local shops and eateries that serve delicious Japanese cuisine.

Kamakura offers a rich tapestry of experiences that will leave you with lasting memories. This charming city is not just a day trip from Tokyo; it's an invitation to step back in time and embrace the beauty of Japan's heritage and natural wonders.","",https://media.safariportal.app/store/asset/2056852/file/38d54f7e4a157bcfbbf430441d1f13b8.jpg
Ise Shima,Japan,Ise,"34.487486,136.709264",https://media.safariportal.app/store/asset/2056979/file/dcce67c0fa7c2b64e9518369c1b574f7.jpg,,Area Overview,"Ise Shima, located on the stunning coast of Japan, is a captivating blend of natural beauty and rich cultural heritage. Renowned for its picturesque landscapes, the region boasts breathtaking coastal views, lush greenery, and serene beaches that invite exploration and relaxation. At the heart of Ise Shima lies the revered Ise Grand Shrine, a spiritual haven that draws visitors from around the world, offering a glimpse into Japan's ancient traditions and Shinto practices.

As you wander through the charming towns and coastal paths, you'll discover local delicacies, particularly the region's famous seafood, including succulent abalone and fresh oysters. The warm hospitality of the locals adds to the experience, making Ise Shima not just a destination, but a place where memories are made. Whether you're seeking adventure, tranquility, or a deeper understanding of Japanese culture, Ise Shima promises an unforgettable journey that will leave you enchanted.","",https://media.safariportal.app/store/asset/2056959/file/fb266aea5603435b95c352206239950d.jpg
Awaji Island,Japan,Awaji,"34.325712,134.813111",https://media.safariportal.app/store/asset/2060577/file/efb2360e6360dfdded1f0acce48e12e3.jpg,,Area Overview,"Awaji Island, nestled in the heart of Japan, is a serene escape known for its stunning natural landscapes and rich cultural heritage. This charming island, part of Hyogo Prefecture, is celebrated for its picturesque coastlines, lush gardens, and the iconic Awaji Yumebutai, a unique architectural marvel designed by renowned architect Tadao Ando. 

Visitors can indulge in the island's culinary delights, particularly its famous Awaji beef and fresh seafood, which reflect the region's maritime bounty. The island is also home to tranquil hot springs, offering a rejuvenating experience amidst nature. 

Whether you're exploring the vibrant flower parks, visiting historic shrines, or simply enjoying the breathtaking views of the Seto Inland Sea, Awaji Island promises an intimate yet enriching travel experience that captures the essence of Japan's tranquil beauty.","",https://media.safariportal.app/store/asset/2060567/file/ef2a55ae1be3da7ca28ca72cedb72c6d.jpg
Onomichi,Japan,Onomichi,"34.4089,133.204914",https://media.safariportal.app/store/asset/2060687/file/c38f343db176408cbfb7e23a7a3345c4.jpg,,Area Overview,"Nestled along the serene coastline of Hiroshima Prefecture, Onomichi is a charming city that invites visitors to explore its rich tapestry of history and natural beauty. Known for its picturesque hills that cradle traditional wooden houses and ancient temples, Onomichi offers a unique blend of tranquility and cultural depth. The city's vibrant streets are perfect for leisurely strolls, where you can discover quaint cafes and local shops that showcase the region's artisanal crafts.

Onomichi is also famous as a starting point for the Shimanami Kaido cycling route, attracting outdoor enthusiasts eager to experience breathtaking views of the Seto Inland Sea. Whether you are wandering through the sacred paths of its historic temples or savoring fresh seafood at a local eatery, Onomichi promises an intimate connection to Japan's heritage and its stunning landscapes. This delightful city is a hidden gem that captivates the heart of every traveler who ventures here.","",https://media.safariportal.app/store/asset/2060683/file/dd28c83b2abda0480da7ab347c44dc8c.jpg
Kanazawa,Japan,"1-chōme-1-1B1F Hirosaka, Kanazawa, Ishikawa 920-0962, Japan","36.559734,136.652038",https://media.safariportal.app/store/asset/2060722/file/106c43ebd4dcf883ce67d8b6ff7c5eba.jpg,,Area Overview,"Nestled along the coast of the Sea of Japan, Kanazawa is a city that beautifully marries tradition with modernity. Known for its well-preserved Edo-era districts, Kanazawa invites travelers to wander through the enchanting streets of Higashi Chaya, where the charm of historic teahouses still lingers in the air. The city is also home to the stunning Kenrokuen Garden, often regarded as one of Japan's most beautiful landscapes, offering a serene escape with its seasonal blooms and tranquil ponds.

As you explore Kanazawa, the rich cultural heritage unfolds through its renowned museums, such as the 21st Century Museum of Contemporary Art, which showcases innovative works in a striking architectural setting. The local cuisine, particularly the fresh seafood from the region, adds another layer to the experience, making dining here a delightful adventure.

Kanazawa is more than just a destination; it’s a place where history whispers through the streets, and every corner tells a story. Whether you’re seeking artistic inspiration or a peaceful retreat, Kanazawa promises an intimate journey into the heart of Japan's cultural tapestry.",Kanazawa_Base,https://media.safariportal.app/store/asset/2060715/file/7df0cbb13db487914c7384625e17a43e.jpg
Nikko,Japan,Nikko,"36.719899,139.698236",https://media.safariportal.app/store/asset/2077760/file/0a1cf38a7c191b0339c0e34aa387f8ac.jpg,,Area Overview,"Located in the mountains north of Tokyo, Nikkō is defined by the close relationship between sacred architecture and its natural setting. Shrines and temples sit within dense forest, connected by paths, rivers, and long-established ritual routes. 

Designated as a World Heritage site, the area reflects centuries of spiritual practice, political history, and respect for the surrounding landscape. Beyond its monuments, Nikkō invites a slower pace, where walking, observation, and seasonal change shape the experience as much as the sites themselves.

Away from the main shrine complex, Nikkō opens into quieter spaces of water and woodland, from river gorges to mountain lakes. These areas extend the experience beyond architecture, reinforcing the sense of retreat and continuity between human presence and the natural environment.",Nikko_Base,https://media.safariportal.app/store/asset/2077765/file/91e6d94c56d479aa34be08b82ee4561e.jpg
Kochi,Japan,"Kochi, Japan","33.558882,133.531238",https://media.safariportal.app/store/asset/2088381/file/cdbaf50cc66ff8dc82143d7ebf9056f9.png,,Area Overview,"Kochi sits on the southern coast of Shikoku, defined by a deep connection to water and landscape. The city and its surrounding prefecture are shaped by clear rivers, broad coastal plains, and wooded hills, with daily life and local culture closely tied to fishing ports, river valleys, and seasonal harvests.

Kochi’s urban center is grounded and walkable, with markets, cafés, and civic spaces that reflect a measured pace. Beyond the city, the Niyodo River and Pacific coastline offer access to river rafting, snorkeling, and open-air time, while historic sites and slow-moving local festivals reveal a rhythm of place that balances natural scale, craft, and everyday life.","",https://media.safariportal.app/store/asset/2099249/file/55b82b1339e5c8815bcfb97a51bfbc23.jpeg
Kawaguchiko,Japan,Kawaguchiko,"35.497314,138.755199",https://media.safariportal.app/store/asset/2094068/file/1cedb6df263a9df0c56c7c11a9c46366.jpg,,Area Overview,"Located at the northern base of Mount Fuji, Kawaguchiko offers some of the most iconic and accessible views of Japan’s sacred peak. The lake is part of the Fuji Five Lakes region and provides a relaxed setting with scenic walking paths, small museums, cafés, and lakeside onsen.

Throughout the year, the area changes character with the seasons, from cherry blossoms in spring to vibrant autumn foliage and snow-dusted landscapes in winter. Its slower pace makes Kawaguchiko an ideal base for travelers seeking nature, photography, and quiet moments framed by Mount Fuji.",Kawaguchiko_Base,https://media.safariportal.app/store/asset/2094069/file/09ea0802a26de34fc91c793086555b0d.jpg
Karuizawa,Japan,Karuizawa,"36.348393,138.59703",https://media.safariportal.app/store/asset/2094079/file/0c7d028de18765a7960fa3c6f1d383fa.jpg,,Area Overview,"Karuizawa is a sophisticated mountain town that has served as a summer retreat since the early 20th century, valued for its cool climate and forested surroundings. Easily accessible from Tokyo, it blends natural scenery with a discreet resort atmosphere shaped by Western-style villas, historic churches, and wide cycling paths.

The town offers a balance of outdoor activities and refined leisure, including hiking, shopping, cafés, and cultural spots, with nearby ski areas in winter. Karuizawa appeals to travelers looking for fresh air, space, and understated elegance in a natural setting.","",https://media.safariportal.app/store/asset/2094080/file/06bf28a5e434a8a7216b41db12dc9ab8.jpg
