Area Name,Country,Location,GPS Coordinates,Primary Photo,Subheadline,Header,Description,Tags,Photos
Niseko,Japan,Niseko,"42.804786,140.687449",https://media.safariportal.app/store/asset/2140394/file/e8f6195f71499cf16af1ed699e52998e.jpeg,,Why we recommend it,"Niseko is Japan’s most refined winter destination for travelers who want snow, comfort, and ease without compromising quality. It offers reliable powder, excellent infrastructure, and a level of hospitality that makes winter travel feel seamless.

We include Niseko because it allows a very specific kind of Japan experience: nature-driven, design-forward, and restorative. When curated well, Niseko is not only a ski trip. It becomes a winter retreat with beautiful accommodations, thoughtful dining, and access to quieter Hokkaido landscapes.

Niseko sits in southwestern Hokkaido, with Mt. Yotei as its defining presence. The area is known for its snow conditions and long season, but the broader appeal is how well it supports high-end travel. Logistics are smooth, lodging standards are strong, and the region is built to deliver comfort in winter.

Niseko is made up of several interconnected areas. Hirafu is the main hub with the most dining, shopping, and nightlife, and it is ideal for travelers who want convenience and energy. Hanazono offers a quieter, more resort-style atmosphere with excellent facilities. Niseko Village provides a polished base with ski-in ski-out comfort. Annupuri is calmer and more local, often preferred by travelers who want a slower pace and fewer crowds.

Dining in Niseko is surprisingly good, with a mix of Japanese, modern, and international options. The best experiences come from reservations made early, especially during peak season. We also recommend balancing restaurant dining with one or two simple local meals, as Hokkaido’s ingredient quality is exceptional.

Niseko works best when the itinerary protects rest. Ski days are naturally demanding, and the most refined experience includes onsen time, late breakfasts, and one or two carefully chosen excursions rather than constant activity. For non-skiers, the region still offers winter beauty through snowshoe walks, scenic drives, and quiet cafés.",Niseko_RI,https://media.safariportal.app/store/asset/243031/file/fe6dc55b72b6c2de7b35e3575ce1fc1e.jpg
Seoul,Korea,Seoul,"37.550263,126.997083",https://media.safariportal.app/store/asset/2106978/file/fa692b56439b3b36c955efc6a0b3eff0.jpg,,Why we recommend it,"Seoul is one of Asia’s strongest cities for travelers who value design, dining, and culture that feels current. It moves quickly, but it is also precise: the hospitality is high standard, the creative scene is mature, and the city is built for people who enjoy discovering neighborhoods with distinct identities.

We include Seoul because it offers a rare balance of tradition and modernity without feeling staged. Palaces and hanok neighborhoods coexist with contemporary galleries, refined restaurants, and a fashion and interiors culture that is globally relevant. When curated well, Seoul feels both exciting and deeply considered.

Seoul is best experienced through neighborhoods. The city is large, but each area has a clear personality, and moving between them reveals different versions of Seoul.

The historic core holds much of the city’s visual heritage: palaces, stone walls, and traditional architecture. This is where Seoul’s cultural roots are most visible, especially when paired with museums that give context beyond the surface beauty. The hanok districts offer a more intimate scale, and the best moments often come from quieter streets, small ateliers, and traditional tea culture.

Seoul’s contemporary identity is equally strong. Districts like Hannam, Seongsu, and parts of Jongno and Yongsan reflect the city’s design intelligence: independent galleries, concept spaces, cafés with architectural intent, and boutiques that feel directional rather than commercial. These areas show Seoul as a creative capital, not simply a shopping city.

Dining is one of Seoul’s defining strengths. The range is exceptional: deeply traditional Korean cuisine, ingredient-driven contemporary dining, and a confident natural wine and cocktail culture. Seoul rewards travelers who approach food with the same curiosity they bring to art or design, because the best meals often reflect heritage, technique, and local sourcing rather than trend.

The city also has a distinctive sense of atmosphere. Seoul is visually powerful, with a rhythm that shifts from calm, almost ceremonial spaces to energetic streetscapes. That contrast is part of its appeal, and it is why Seoul works so well for travelers who want both culture and modern life in the same destination.",Seoul_RI,https://media.safariportal.app/store/asset/172905/file/19ca79facce05bb2ba495bb8203790e1.jpg
Ishigaki,Japan,Ishigaki,"24.337859,124.178419",https://media.safariportal.app/store/asset/2094312/file/1a346c33ee7c57ddc120b9c8ab62df6c.jpg,,Why we recommend it,"Ishigaki offers a version of Japan that feels expansive and elemental: subtropical sea, open skies, and a slower island rhythm. It is refined without being formal, and it appeals to travelers who want nature and beauty with comfort and privacy.

We include Ishigaki because it delivers true escape while still feeling culturally specific. It is not only about beaches. The island has a strong local identity, a distinct food culture, and access to some of the most beautiful water in Japan. When curated well, Ishigaki becomes restorative and quietly luxurious.

Ishigaki is the main gateway to the Yaeyama Islands, and it works well both as a standalone island stay and as a base for exploring nearby islands. The landscape is defined by coral reefs, mangrove rivers, and lush interior hills, with a coastline that shifts from calm turquoise bays to dramatic viewpoints.

The island’s strongest experiences come from being on the water. Visibility is excellent, reefs are close to shore, and the marine environment is rich. Snorkeling and diving are world-class, but even travelers who do not dive can access the beauty through boat excursions and carefully chosen beaches with clear, calm water. Sunset and early morning light are particularly striking here, and the island’s pace naturally encourages slower days.

Ishigaki also has a distinct culinary identity. Local beef, Yaeyama soba, and seasonal island produce give meals a different character than mainland Japan. Dining is generally more relaxed, but quality can be excellent when selected carefully, especially for seafood and local specialties.

Beyond the coastline, Ishigaki’s interior has a quieter presence: subtropical forest, small farms, and traditional villages. The best itineraries balance a few key water experiences with one inland moment, creating a fuller sense of place rather than a resort-only stay.",Ishigaki_RI,https://media.safariportal.app/store/asset/2094321/file/63c75caae6bd7b46fbea91bb6c0d4b74.jpg
Kawaguchiko,Japan,Kawaguchiko,"35.497314,138.755199",https://media.safariportal.app/store/asset/2140517/file/974f58d8aaf505e1edd3d1c77f4ba1fe.png,,Why we recommend it,"Kawaguchiko offers one of Japan’s most iconic landscapes, but the value is not only the view. When curated well, it becomes a place of stillness, clean air, and simple beauty, where nature and design-led hospitality work together.

We include Kawaguchiko because it gives access to Mt. Fuji in a way that can feel intimate rather than touristic. It is ideal for travelers who want a short retreat from the cities, with space for slow mornings, lakeside walks, and carefully chosen cultural stops.

Kawaguchiko sits in the Fuji Five Lakes region, with Mt. Fuji as the constant presence shaping the atmosphere. The area’s appeal changes with the seasons: crisp visibility in colder months, fresh greens in spring, deep summer light, and dramatic autumn color. The experience is as much about weather and timing as it is about specific places.

The lake itself sets the rhythm. The best moments are quiet and simple: a lakeside walk, a viewpoint with no urgency, a coffee stop with Fuji in the background. The area is compact, but it benefits from intentional routing, because the difference between a crowded stop and a calm one is often just a few minutes away.

Beyond the landscape, Kawaguchiko has a strong craft and museum layer that is often overlooked. There are small cultural institutions and ateliers that feel personal, and they pair well with the scenery because they reinforce the region’s relationship with nature and Japanese aesthetics.

Accommodations shape the experience significantly. The most refined stays prioritize views, privacy, and onsen culture. This is a destination where less is more: one or two meaningful outings, balanced with time at the property, tends to create the most elevated experience.",Kawaguchiko_RI,https://media.safariportal.app/store/asset/2094069/file/09ea0802a26de34fc91c793086555b0d.jpg
Nikko,Japan,Nikko,"36.719899,139.698236",https://media.safariportal.app/store/asset/2077760/file/0a1cf38a7c191b0339c0e34aa387f8ac.jpg,,Why we recommend it,"Nikko offers one of Japan’s most powerful combinations of nature and sacred culture. It is a place where craftsmanship, ritual, and landscape come together with real intensity, but the experience can still feel quiet when curated well.

We include Nikko because it delivers depth. The shrines and temples are visually extraordinary, yet the most lasting impression often comes from the cedar forests, misty air, and the feeling of entering a mountain sanctuary. Nikko is ideal for travelers who want history and nature in equal measure, with a sense of atmosphere that feels unmistakably Japanese.

Nikko sits at the edge of the mountains north of Tokyo, and its identity is shaped by spiritual tradition and dramatic landscape. For centuries, it has been one of Japan’s most important sacred sites, and the entire area carries that sense of reverence. The architecture is celebrated for a reason, but Nikko’s true strength is how the setting amplifies it: towering cedars, mossy stone paths, and shifting mountain light.

The main temple and shrine complex is the cultural anchor, with craftsmanship that is unusually elaborate. However, Nikko becomes most rewarding when the visit goes beyond the main courtyard experience. The quieter forested areas, lesser-visited halls, and small moments of ritual create a deeper understanding of the place.

Nature is inseparable from the cultural experience. Nikko’s surrounding area offers lakes, waterfalls, and mountain roads that change dramatically by season. Autumn color is famous, but winter and early spring can be even more atmospheric, with fewer visitors and a more solemn, almost cinematic mood. The region also has strong onsen culture, and a carefully chosen stay can turn Nikko into a true retreat rather than a quick excursion.

Because the highlights are concentrated, pacing is everything. Nikko benefits from a focused itinerary that leaves space to walk slowly, spend time in the forest, and avoid the feeling of “sightseeing.” It is a destination where silence and weather are part of the experience.",Nikko_RI,https://media.safariportal.app/store/asset/2077765/file/91e6d94c56d479aa34be08b82ee4561e.jpg
Yufuin,Japan,Yufuin,"33.266822,131.361",https://media.safariportal.app/store/asset/2162830/file/eb54661adac13c5b07786411b4550598.jpg,,Why we recommend it,"Yufuin offers a gentler interpretation of the onsen experience. It is not dramatic or grand in scale; it is intimate, rural, and quietly aesthetic. For travelers seeking stillness without isolation, it provides a refined balance between nature and comfort.

We include Yufuin because it allows guests to experience Japan’s relationship with landscape in a personal way. Here, mountains are not a backdrop but a presence. Steam rises from the earth, seasons are felt distinctly, and time moves more slowly. When curated thoughtfully, Yufuin becomes less about sightseeing and more about atmosphere.

Yufuin sits at the base of Mount Yufu in Ōita Prefecture, surrounded by farmland, low mist, and soft mountain light. Unlike larger hot spring towns, it feels open and breathable. The basin landscape creates wide skies and shifting seasonal textures, fresh green rice fields in spring, dense summer foliage, amber grasses in autumn.

The town developed as a retreat for artists and writers, and that sensibility remains. Small museums, independent cafés, and craft shops are integrated quietly into the rural setting. While there is a central pedestrian street, the character of Yufuin reveals itself just beyond it,  in narrow lanes, wooden ryokan, and private gardens partially hidden behind simple gates.

Yufuin’s luxury is understated. Many of the most memorable stays are found in small ryokan with only a handful of rooms, each with its own bath facing a garden or mountain view. The emphasis is not on spectacle but on privacy, proportion, and detail: seasonal kaiseki dinners, tatami rooms that frame the landscape, baths that blur the boundary between indoors and outdoors.

Time here is best structured loosely. A morning soak, a late breakfast, a slow walk through quiet streets, tea in the afternoon, another bath at dusk. The experience is cyclical rather than scheduled. Yufuin rewards those who resist urgency.",Yufuin_RI,https://media.safariportal.app/store/asset/2162834/file/3b37249b5121c37fc36e086c6d1ce77c.jpg
Mt. Aso,Japan,Mt. Aso,"32.898506,131.087475",https://media.safariportal.app/store/asset/2162891/file/09225bca15795e3459a4833afb68ccf1.jpeg,,Why we recommend it,"Mount Aso offers one of Japan’s most powerful natural landscapes. It is expansive rather than intimate, dramatic rather than delicate. For travelers who want to experience Japan beyond temples and cities, Aso introduces a different scale entirely.

We include Aso because it reveals Japan’s geological force. This is one of the world’s largest active volcanic calderas, and you feel that presence immediately;  in the open plains, the smell of sulfur, the wind moving across grasslands. It is not curated beauty. It is living terrain.

Located in central Kyushu, Mount Aso is not a single peak but a vast caldera containing multiple volcanic cones, including the active Nakadake crater. The surrounding landscape feels unexpectedly open: rolling grasslands, grazing horses, wide skies. The sense of space is rare in Japan and changes the rhythm of travel immediately.

The region is rural and agricultural, shaped as much by cattle farming as by volcanic activity. Small villages, simple farmhouses, and quiet roadside stations define the human presence here. Architecture is modest. The landscape is the focal point.

Access to the crater depends on volcanic conditions, which makes every visit slightly different. When open, the walk toward the crater edge is stark and surreal: black rock, white steam, mineral-colored earth. When closed, the surrounding trails and viewpoints still provide vast, cinematic perspectives across the caldera.

Staying overnight in the area shifts the experience. As day visitors leave, the land becomes quieter, and the scale of the sky becomes more apparent. Sunset over the grasslands and early morning mist settling in the basin are often more memorable than the crater itself.",Mt. Aso_RI,https://media.safariportal.app/store/asset/2162914/file/3cea2b2dce249e53810f0a4be26c139f.jpg
Kumamoto,Japan,Kumamoto,"32.803216,130.707937",https://media.safariportal.app/store/asset/2163010/file/56ca972604415bfca23f262ed8c29bb2.jpg,,Why we recommend it,"Kumamoto offers a more grounded, regional perspective on Japan. It does not perform for visitors. Instead, it reveals a city shaped by resilience, strong local identity, and deep connection to land.

We include Kumamoto because it provides balance. After volcanic landscapes or onsen retreats, the city introduces urban comfort without intensity. It feels approachable yet culturally substantial; a place where history, food culture, and everyday life intersect naturally.

Located in central Kyushu, Kumamoto is best known for Kumamoto Castle, one of Japan’s most important feudal castles. Damaged in the 2016 earthquake and still undergoing restoration, it stands not only as an architectural landmark but as a symbol of the city’s recovery. The reconstruction process itself has become part of the experience, reflecting patience and long-term care.

Beyond the castle, Kumamoto is a livable, compact city. Wide streets, a modest tram system, and an easy walking layout make it simple to navigate. The atmosphere is relaxed, with a strong local dining scene rooted in regional ingredients, notably Akaushi beef, fresh produce, and clean, mineral-rich water sourced from the surrounding mountains.

Water defines Kumamoto more than many visitors realize. The city’s drinking water comes from natural underground springs fed by Mount Aso. This shapes everything from sake brewing to tofu production and gives the cuisine a clarity and softness that is subtle but distinct.

Kumamoto is not about volume of attractions. It is about coherence: castle, gardens, arcades, and residential neighborhoods woven together in a scale that encourages unhurried exploration.",Kumamoto_RI,https://media.safariportal.app/store/asset/2163060/file/22acde3f589d87cda5a4cc8ae9335c44.jpg
Yame,Japan,Yame,"33.211956,130.557931",https://media.safariportal.app/store/asset/2163289/file/960c1e95028fa1d2f92e9bfcf0734d3f.jpeg,,Why we recommend it,"Yame offers access to a slower, agricultural Japan that feels authentic without effort. It is not curated for tourism, which is precisely its strength. For travelers seeking depth over volume, Yame provides cultural substance in a compact, walkable setting.

We include Yame because it represents continuity, tea cultivation, traditional craft, and merchant architecture that have evolved without losing integrity. It is a place where production still defines identity. Visiting Yame is less about seeing and more about understanding.

Located south of Fukuoka in Kyushu, Yame is most widely known for its high-quality green tea, particularly gyokuro. The surrounding hills are covered in carefully shaded tea fields, and the cultivation methods require patience, skill, and precise timing. Tea here is not branding,  it is livelihood and legacy.

The old town area preserves white-walled merchant houses, wooden facades, and narrow streets that reflect its Edo- and Meiji-period prosperity. Unlike more restored districts elsewhere in Japan, Yame’s historical core feels lived-in rather than staged. Some buildings operate as small galleries or tea shops; others remain private homes.

Yame is also known for traditional crafts, including handmade washi paper and Buddhist altar craftsmanship. These practices developed in tandem with tea culture and regional trade. The scale remains small, often family-run, and deeply specialized.

Time in Yame moves through small gestures: a tea tasting, a conversation with a shop owner, a walk between warehouses converted into quiet ateliers. It is a town that rewards attention to detail rather than movement between major sights.",Yame_RI,https://media.safariportal.app/store/asset/2163293/file/f438ef2d9d6f772a41b57e0e0fa2095f.png
Takayama,Japan,Takayama,"36.146132,137.252159",https://media.safariportal.app/store/asset/2174285/file/309c35dacc667c705176ba38ec5a21e7.jpg,,Why we recommend it,"Takayama offers one of Japan’s most intact historic townscapes, set within a dramatic mountain environment. It provides architectural continuity without feeling overly reconstructed. For travelers wanting a strong sense of place, Takayama delivers clarity and atmosphere.

We include Takayama because it preserves regional identity. Isolated for centuries by the surrounding Hida mountains, the town developed its own craft traditions, carpentry techniques, and culinary culture. The result is a destination that feels distinct from the more polished heritage districts closer to major cities.

Located in Gifu Prefecture in the Japanese Alps, Takayama is often referred to as Hida-Takayama, reflecting its deep connection to the Hida region. The old town district features narrow streets lined with dark wooden merchant houses, sake breweries, and lattice-fronted facades dating back to the Edo period. The scale is intimate, best explored on foot.

Takayama’s history as a center of skilled carpenters shaped its architectural precision. Many of the preserved buildings reflect refined joinery and proportion. The town also maintains strong ties to seasonal festivals, particularly the Takayama Matsuri, known for its elaborate festival floats,  a testament to regional craftsmanship and community continuity.

Culinary identity here is grounded in climate and geography. Hida beef, mountain vegetables, miso, and sake brewed from clear alpine water define the local table. Markets in the morning along the Miyagawa River introduce this agricultural context in a simple, accessible way.

While parts of the old town can feel busy midday, the atmosphere shifts early in the morning and again toward evening. When the tour groups thin, the wood tones deepen, lanterns glow softly, and the mountain air becomes part of the experience.",Takayama_RI,https://media.safariportal.app/store/asset/2174287/file/c776344a675bb19f722af790bda0fc1c.jpg
Ubud,Indonesia,Ubud,"-8.506854,115.262478",https://media.safariportal.app/store/asset/347474/file/1e872b602301eb5f976ea775095d0db9.jpg,,Why we recommend it,"Ubud offers a more introspective experience of Bali. It is less about coastline and more about culture, ceremony, and landscape. For travelers seeking depth beyond beach resorts, Ubud provides a textured, sensory immersion.

We include Ubud because it allows visitors to engage with Balinese philosophy in everyday life. Offerings on sidewalks, temple ceremonies, family compounds, rice cultivation; spirituality and daily routine are not separated here. When curated thoughtfully, Ubud becomes grounding rather than overwhelming.

Located in the central highlands of Bali, Ubud is surrounded by rice terraces, river valleys, and dense tropical forest. The terrain shapes the rhythm of the town; steep paths, hidden stairways, villas perched above ravines, and the constant sound of water moving below.

Historically a center for Balinese art and craftsmanship, Ubud became a gathering place for painters, dancers, woodcarvers, and spiritual teachers. That creative lineage remains visible in small galleries, temple festivals, and family-run workshops. While tourism is well established, cultural continuity is still deeply present.

The town center can feel dense, particularly around the palace and main market, but just a short walk outward shifts the atmosphere entirely. Side streets lead to quiet compounds, small warungs, and open views across rice fields. Ubud reveals itself in layers: temple smoke at dawn, gamelan music at night, processions that temporarily pause traffic.

Dining and wellness culture have also become central to Ubud’s identity. From traditional Balinese kitchens to contemporary plant-based restaurants and spa rituals, the town integrates nourishment and restoration naturally. The key is choosing carefully and avoiding the overly commercialized surface.

Time in Ubud benefits from intentional pacing. Early mornings and late afternoons offer the most atmospheric light and quieter paths. Midday is best spent in shade; at a spa, in a gallery, or resting.",Ubud_RI,https://media.safariportal.app/store/asset/2179342/file/e3ba71b0508490e5bca6da11dde116d5.jpg
Lombok,Indonesia,Lombok,"-8.650979,116.324944",https://media.safariportal.app/store/asset/2179424/file/4495d97bd2be56dab9e859d302a1ca27.jpeg,,Why we recommend it,"Lombok offers a quieter counterpoint to Bali. It is less stylized, less curated, and far less saturated with tourism infrastructure. For travelers who want space, physical and psychological, Lombok provides it generously.

We include Lombok because it delivers contrast. The landscapes feel expansive, the beaches are often uncrowded, and the cultural rhythm is distinct. It is a destination for those who value simplicity, open terrain, and slower interaction over scene and spectacle.

Located east of Bali in Indonesia’s West Nusa Tenggara province, Lombok is dominated by Mount Rinjani, one of Southeast Asia’s most striking volcanoes. The mountain defines both geography and identity. Villages cluster along its slopes, and agricultural life remains central to the island’s structure.

The southern coastline is where Lombok’s scale becomes most apparent. Long, undeveloped beaches curve along dry hills and open ocean. Infrastructure is growing, particularly around areas like Kuta Lombok, but the feeling remains more rural than resort-driven. Roads pass through grazing land and small settlements before opening suddenly onto dramatic coastal views.

Culturally, Lombok is predominantly Sasak and Muslim, which gives it a different social rhythm from Bali. Mosques punctuate the landscape, and daily life moves with a quieter cadence. Traditional weaving villages and small local markets reflect this regional identity without theatrical staging.

Lombok’s luxury, when present, is typically expressed through isolation; hillside villas, simple beachfront stays, and properties designed to frame sunset rather than host nightlife. The island rewards those who accept its pace rather than attempt to accelerate it.",Lombok_RI,https://media.safariportal.app/store/asset/202209/file/1313dc5c14d37a210def943ba858fe67.jpg
